Borough,Site Name,Site Address,Postcode,Type of Site,Grid ref easting,Grid ref northing,Open to Public,Opening times,Site Ref
Merton,Watermeads Housing Estate,off Rawnsley Avenue/Bishopsford Road,CR4,Housing/Estate Landscaping,527050,167950,No,"private, visible from Ravensbury Park",MER062
Merton,West End Chesed V'Ameth Cemetery,Rowan Road,SW16 5JF,Cemetery,529328,169212,Yes,(to check times),MER063
Merton,Wimbledon College,Edge Hill,SW19 4NS,Institutional Grounds,523750,170350,No,private,MER064
Merton,Wimbledon Common,Wimbledon Parkside/Cannizaro Road/Roehampton Vale,SW19/SW20,Public Open Land,522950,171550,Yes,unrestricted,MER065
Merton,Wimbledon Park (including Wimbledon Golf Course) *,Wimbledon Park Road/Home Park Road,SW19,Public Park;,524850,172450,Yes,8am - dusk (weekdays); 9am - dusk (weekends/Bank Holidays),MER066
Merton,Windyridge House,"19/21 Marryat Road, Wimbledon",SW19,Private Garden,523893,171408,No,private,MER067
Newham,Abbey Mills Pumping Station Grounds,Abbey Lane,E15 2RW,Institutional Grounds,538750,183350,By appointment only,The historic part of the site has opened for London Open House.,NEW001
Newham,All Saints Churchyard,"Church Street/Church Street North/Church Passage, West Ham",E15 3HU,Churchyard,539415,183868,Yes,unrestricted; church open for Open House,NEW002
Newham,Barking Road Recreation Ground,"Barking Road/Burges Road, East Ham",E6,Public Park,543350,183850,Yes,dawn to dusk,NEW003
Newham,Brampton Park,Masterman Road/Lonsdale Avenue/Brampton Road,E6,Public Park,542150,182554,Yes,dawn to dusk,NEW004
Newham,Canning Town Recreation Ground,Prince Regent Lane/Newham Way/Freemasons Road,E16,Public Park,540850,181650,Yes,dawn to dusk,NEW005
Newham,Central Park,"Bartle Avenue/Rancliffe Road/Cheltenham Gardens/ High Street South, East Ham",E6,Public Park,542500,183500,Yes,dawn to dusk,NEW006
Newham,City of London Cemetery and Crematorium *,"Aldersbrook Road, Manor Park",E12,Cemetery,542250,186250,Yes,Mon-Fri/Sat/Sun: 9am-5pm (winter); -7pm (summer). B Hols 91m-5pm. Xmas/Boxing Day 9am-3pm.,NEW007
Newham,East Ham Jewish Cemetery,"Marlow Road off Sandford Road, East Ham",E6 3QG,Cemetery,542350,182550,Yes,"Mon-Thurs & Sun: 9am-5pm (summer); 9am-4pm (winter); Friday: 9am-4pm (summer), 9am-3pm (winter). Closed Sats, Jewish Holidays",NEW008
Newham,East Ham Nature Reserve,"Norman Road/High Street South, East Ham",E6 4HN,Churchyard,542950,182350,Yes,"Tues-Fri 10am-5pm (summer)/4pm (winter); Sat/Sun: 2pm-5pm (summer), 1pm-4pm (winter). Church open by appointment",NEW009
Newham,East London Cemetery and Crematorium,"Grange Road, Plaistow",E13 0HB,Cemetery,539850,182850,Yes,Mon-Sat 8.30am-4.30pm; Sun 10am-4.30pm; BH: 1-4.30pm.,NEW010
Newham,Emmanuel Churchyard,Upton Lane/Romford Road,E7,Churchyard,540612,184993,Yes,unrestricted,NEW011
Newham,Forest Lane Park,"Magpie Close, Forest Lane, Maryland",E7,Public Park,539670,185233,Yes,dawn to dusk,NEW012
Newham,Hermit Road Recreation Ground,"Hermit Road, Plaistow",E16,Public Park,539850,182450,Yes,dawn to dusk. Arc in the Park open term-time Tue-Fri 3.30-6.30; Sat 9.30-4; holidays M-F 9.30-4pm,NEW014
Newham,Keir Hardie Recreation Ground,"Appleby Road/Tarling Road/Redland Road, Custom House",E16,Public Park,539950,181150,Yes,dawn to dusk,NEW015
Newham,King George V Park,"King George's Avenue/Stansfield Road, Custom House",E16,Public Park,541650,181350,Yes,dawn to dusk,NEW016
Newham,Lister Gardens,"Upper Road/Florence Road, Plaistow",E13,Public Gardens,540059,183028,Yes,dawn to dusk,NEW017
Newham,Little Ilford Park,"Reynolds Avenue/Church Road, Manor Park",E12,Public Park,543350,185350,Yes,dawn to dusk,NEW018
Newham,Lyle Park,"Bradfield Road, Silvertown",E16,Public Park,540550,179850,Yes,dawn to dusk,NEW019
Newham,Manor Park Cemetery and Crematorium,"Sebert Road/Whitta Road, Manor Park",E7 0NP,Cemetery,541450,185750,Yes,Mon-Fri 9am - 7pm (April-September)/ - 5pm (October-March). Sat/Sun/BH: 10am - 5pm (Apr-Sept)/4pm (Oct-Mar),NEW020
Newham,"Memorial Garden, Bromley by Bow Gasworks",Twelvetrees Crescent,E3 3JH,Private Garden,538555,182399,to check,,NEW021
Newham,Memorial Grounds,"Memorial Avenue/Ronald Avenue, West Ham",E15 3DB,Public Park,539350,182850,Yes,dawn to dusk,NEW022
Newham,New Beckton Park,"Savage Gardens/Manor Way, East Ham",E6,Public Park,543050,181150,Yes,dawn to dusk,NEW023
Newham,Plaistow Park,"Greengate Street/Balaam Street, Plaistow",E13 0AS,Public Park,540596,182827,Yes,dawn to dusk,NEW024
Newham,Plashet Jewish Cemetery,High Street North,E12 6PQ,Cemetery,542050,184850,By appointment only,,NEW025
Newham,Plashet Park,"Plashet Grove/Woodhouse Grove/Shrewsbury Road, Forest Gate",E7,Public Park,541993,184416,Yes,dawn to dusk. Zoo: Tue-Sun 10-5pm (summer)/4pm (winter)r,NEW026
Newham,Royal Victoria Gardens,"Pier Road, off Albert Road, Custom House",E16,Public Park,543450,179850,Yes,dawn to dusk,NEW027
Newham,St John the Evangelist Churchyard,Stratford Broadway,E15 1NG,Churchyard,538999,184447,Yes,unrestricted,NEW028
Newham,"St Mary the Virgin Churchyard, Little Ilford",Church Road,E12,Churchyard,542916,185290,Yes,unrestricted,NEW029
Newham,St Mary's Churchyard,"St Mary's Road, Plaistow",E13,Public Gardens,540550,183350,Yes,unrestricted,NEW030
Newham,Stratford Park,"West Ham Lane/Densham Road, Stratford",E15,Public Park,539350,184050,Yes,dawn to dusk,NEW031
Newham,Thames Barrier Park,North Woolwich Road,E16 2HP,Public Park,541255,180001,Yes,7am - dusk,NEW032
Newham,The Greenway,Wick Lane to Beckton,E15/E13/E6,Public Open Land,537168,183904,Yes,unrestricted,NEW013
Newham,Three Mills Green and Three Mills Island,Three Mills Lane,E3 3DU,Public Park,538450,183050,Yes,"unrestricted. House Mill open for tours Sundays 1-4pm, May-October.",NEW033
Newham,West Ham Cemetery,Cemetery Road,E7 9DG,Cemetery,539850,185650,Yes,Daily 9am (summer)/10am (winter) to dusk,NEW034
Newham,West Ham Jewish Cemetery,"Buckingham Road, Forest Lane",E15 1SP,Cemetery,539609,185650,By appointment only,,NEW035
Newham,West Ham Park *,Ham Park Road/Upton Lane/Portway,E7 9PU,Public Park,540250,184150,Yes,7.30am-dusk,NEW036
Newham,Woodgrange Park Cemetery,Romford Road,E7,Cemetery,541750,185150,Yes,8am - 8pm (summer); 8am - 4pm (winter),NEW037
Redbridge,Bancroft's School,"611 High Road, Woodford Wells",IG8 0RF,Institutional Grounds,540412,193139,Occasionally,"private, open for Open House",RED001
Redbridge,Barkingside Cemetery,"Longwood Gardens (east), Barkingside, Ilford",IG5 0ET,Cemetery,543850,189850,Yes,"winter Mon-Fri 7.30am-4.30am/Sat 9am-4.30pm/Sun, BHs 10am-4.30pm",RED002
Redbridge,Barkingside Garden of Rest,"Longwood Gardens (west), Barkingside, Ilford",IG5 0ET,Cemetery,543650,189850,Yes,Winter: M-F 7.30am-4.30pm/Sat 9am-4.30pm/Sun/BH 10am-4.30pm,RED003
Redbridge,Barkingside Recreation Ground,"Cranbrook Road/Mossford Green, Barkingside, Ilford",IG6,Public Park,544097,189680,Yes,Daily 8am-dusk (check site owner for closing time); closed Christmas Day,RED004
Redbridge,Barley Lane Recreation Ground,"Barley Lane, High Road, Thackeray Drive, Ilford",RM6 4QT,Public Park,546569,187540,Yes,closes dusk,RED004a
Redbridge,Barnardo's Village Green,"Tanners Lane, Barkingside, Ilford",IG6 1QG,Institutional Grounds,544461,189588,Yes,unrestricted,RED005
Redbridge,Buckingham Road Cemetery,"Buckingham Road, Ilford",IG1 1RE,Cemetery,544850,186750,Yes,"Mon - Fri 7.30am-4.30pm/Sat 9am-4.30pm/Sun, Bank Holidays 10am-4.30pm",RED006
Redbridge,Christ Church Wanstead Churchyard,Wanstead Place/Spratt Hall Road/High Street,E11 2SW,Churchyard,540350,188450,Yes,unrestricted,RED007
Redbridge,Christchurch Green Recreation Ground,Wanstead Place/Spratt Hall Road/High Street,E11,Public Park,540450,188350,Yes,unrestricted,RED008
Redbridge,"Claybury Woods and Park, including Repton Park","Tomswood Hill/Manor Road, Woodford Green, Ilford",IG8 8AJ,Public Park;,543378,191397,Partially,"Claybury Park: daily 8am-dusk (check site owner for closing time); closed Christmas Day. Repton Park housing development is private, residents only.",RED008a
Redbridge,Clayhall Park,"Woodford Avenue/Longwood Gardens, Ilford",IG5,Public Park,542850,189350,Yes,Daily 8am-dusk (check site owner for closing time); closed Christmas Day,RED009
Redbridge,Elmhurst Conference Centre,"98 High Road, South Woodford",E18,Private Garden,540150,190550,to check,,RED010
Redbridge,Elmhurst Gardens,"Gordon Road, South Woodford",E18 1DH,Public Park,540724,190605,Yes,Daily 8am-dusk (check site owner for closing time); closed Christmas Day,RED011
Redbridge,Fairlop Waters Country Park,Forest Road,IG6,Public Park,545350,190650,Yes,unrestricted to most of site,RED012
Redbridge,George Green,"The Green, Wanstead",E11 2NT,Public Open Land,540599,188129,Yes,unrestricted,RED013
Redbridge,Goodmayes Hospital,"Barley Lane, Little Heath, Ilford",IG3 8XJ,Institutional Grounds,546350,188650,Yes,"private, but unrestricted",RED014
Redbridge,Goodmayes Park and Orchard Playing Fields,"Abbotsfield Road/Green Lane/Aberdour Road, Goodmayes, Essex",RM8,Public Park,546650,186550,Yes,Daily 8am-dusk (check site owner for closing time); closed Christmas Day,RED015
Redbridge,Hainault Forest Country Park,"Romford Road, Chigwell",IG7 4QN,Public Park,547666,192885,Yes,unrestricted (part of site),RED016
Redbridge,Harts Hospital,"Snakes Lane West/Harts Grove, Woodford Green",IG8 9QH,Garden Feature Remnants,540261,192112,Partially,"private, but right of way on roadways",RED017
Redbridge,"Holy Trinity Churchyard, Mossford","Mossford Green, Barkingside, Essex",IG6 2BJ,Churchyard,543959,189884,Yes,unrestricted,RED018
Redbridge,Ilford Animal Cemetery,"Woodford Bridge Road, Ilford",IG4 5PS,Cemetery,541863,189464,Yes,8am - dusk,RED018a
Redbridge,Ilford War Memorial Gardens,"Eastern Avenue, Newbury Park, Ilford, Essex",IG2 7RJ,Public Gardens,544750,188250,Yes,"Daily 8am-dusk (check site owner for closing time); closed Christmas Day. Memorial Hall open 1st Sun each month, May-Oct, 2-4.30pm",RED019
Redbridge,Knighton Wood,"Knighton Lane/Monkham's Lane/Forest Way, Woodford Wells",IG8,Public Open Land;,540950,193150,Yes,unrestricted,RED020
Redbridge,Little Heath Green,"Chadwell Heath Lane/Little Heath/Barley Lane, Chadwell Heath",RM6,Public Open Land,546812,189051,Yes,unrestricted,RED021
Redbridge,Loxford Park,"Loxford Lane, Ilford, Essex",IG1,Public Park,544350,185350,Yes,Daily 8am-dusk (check site owner for closing time); closed Christmas Day,RED022
Redbridge,Ray Park,"Snakes Lane East/Ray Lodge Road/Oxford Road, Woodford Green, Essex",IG8,Public Park,541750,192050,Yes,Tues-Sun 8am-dusk (check site owner for closing time); closed Christmas Day,RED023
Redbridge,Rectory Court,189 Woodford High Road,E18,Housing/Estate Landscaping,540050,190650,No,private,RED024
Redbridge,Redbridge Recreation Ground,"Woodford Bridge Road; Keswick Gardens, Ilford",IG4 5ND,Public Park,542051,189362,Yes,8am - dusk,RED025
Redbridge,Seven Kings Methodist Church,"Seven Kings Road/Balmoral Gardens, Seven Kings, Ilford",IG3 8DQ,Churchyard,545525,187055,Occasionally,to check - only when services held in church,RED031
Redbridge,Seven Kings Park,"Aldborough Road South, Ilford, Essex",IG3,Public Park,545950,188250,Yes,Daily 8am-dusk (check site owner for closing time); closed Christmas Day,RED032
Redbridge,Snaresbrook Crown Court,75 Hollybush Hill,E11 1QW,Institutional Grounds,539850,188850,Yes,Pedestrian entrance open Mon-Fri 8am-6pm,RED034
Redbridge,Snaresbrook Memorial Gardens,"Snaresbrook Road, South Woodford",E18 2EL,Private Garden,539933,189123,Partially,Memorial Garden only,RED035
Redbridge,South Park,"South Park Road/South Park Drive/South Park Crescent/South Park Terrace, Ilford, Essex",IG1,Public Park,545067,186310,Yes,Daily 8am-dusk (check site owner for closing time); closed Christmas Day,RED036
Redbridge,"St Mary the Virgin Churchyard, Woodford","High Road, South Woodford, Essex",E18 2QS,Churchyard,540015,190728,Yes,unrestricted,RED026
Redbridge,St Mary the Virgin Great Ilford Churchyard,"High Road, Ilford, Essex",IG1,Churchyard,544836,186815,Yes,unrestricted,RED027
Redbridge,St Mary's Wanstead Churchyard,"Overton Drive, Wanstead, Essex",E11 2LW,Churchyard,540950,187750,Yes,unrestricted.,RED028
Redbridge,"St Paul's Churchyard, Woodford Bridge","Manor Road/Chigwell Road, Woodford Bridge Green",IG8,Churchyard,542625,191809,Yes,unrestricted,RED029
Redbridge,"St Peter's Churchyard, Aldborough Hatch","St Peter's Lane/Aldborough Road North, Newbury Park",IG2 7SZ,Churchyard,545650,189250,Yes,unrestricted. Church open Monday 10am-12 (except Bank Holidays) & Wednesday 10.30am-12 for private prayer,RED030
Redbridge,The Shrubberies,"The Shrubberies, George Lane, South Woodford",E18 1BL,Public Gardens,540350,190350,Yes,unrestricted,RED033
Redbridge,Valentines Park *,"Cranbrook Road/Emerson Road/Bethell Avenue, Ilford",IG1 4XA,Public Park;,543442,187876,Yes,Daily 8am-dusk (check site owner for closing time); closed Christmas Day,RED037
Redbridge,Wanstead Flats and Bush Wood *,"Centre Road/Woodford Road/Aldersbrook Road/Forest Drive, Aldersbrook",E12,Public Open Land,540225,187653,Yes,unrestricted,RED038
Redbridge,Wanstead Golf Course *,"Overton Drive, Wanstead",E11 2LW,Private Open Land;,540812,187495,No,private,RED040
Redbridge,Wanstead Hospital,"Makepiece Road/Victory Road, Hermon Hill, Redbridge",E11 1PA,Institutional Grounds,540491,189247,Yes,private but access appears unrestricted,RED041
Redbridge,Wanstead Park *,"Warren Road/The Avenue, Wanstead",E11 2LT,Public Park;,541483,186387,Yes,unrestricted. The Temple opens Sats and Suns 12-5pm (Summer) and 11am-3pm (Winter),RED042
Redbridge,Wanstead Quaker Burial Ground,"Bush Road, Wanstead",E11 3AU,Cemetery,540381,187116,By appointment only,Please contact the Wardens (Meeting House: 020 8989 4511),RED042a
Redbridge,Wanstead War Memorial Green and Tarzy Wood,"New Wanstead Road/High Street/Fitzgerald Road/Wellington Passage, Wanstead",E11,Public Gardens,540250,188650,Yes,unrestricted,RED043
Redbridge,Weavers' Almshouses,"New Wanstead/Chestnut Drive, Wanstead",E11 2SZ,Private Garden,540050,188150,No,private,RED044
Redbridge,Westwood Recreation Ground,"Meads Lane, Westwood Road, Ilford",IG3,Public Park,545950,187750,Yes,unrestricted,RED045
Redbridge,Woodford Bridge Green,"Manor Road/Cross Road, Woodford Green",IG8 8BT,Public Open Land,542650,191850,Yes,unrestricted,RED046
Redbridge,Woodford Green,"High Road/Broomhill Road, Woodford Green, Essex",IG8,Public Open Land,540150,192050,Yes,unrestricted,RED047
Richmond,Barn Elms Playing Fields,"Queen Elizabeth Walk/Rocks Lane, Barnes",SW13 9SA,Public Park,522952,176461,Yes,Mon - Sat: 7.30am - dusk/Sun & Bank Hols: 9am - dusk,RIC001
Richmond,Barnes Common,Vine Road/Station Road/Mill Hill Road/Rocks Lane,SW13 0NE,Public Open Land,522301,175860,Yes,unrestricted,RIC002
Richmond,Barnes Green,Church Road/Barnes High Street,SW13 9HE,Public Open Land,521926,176309,Yes,unrestricted,RIC003
Richmond,Borough Cemetery,"Powder Mill Lane, Whitton",TW2 6EJ,Cemetery,512974,173447,Yes,"9am - 4pm (Nov-Feb)/- 5.30pm (Mar, Oct)/ - 7pm (Apr, May, Aug, Sept)/ - 8pm (June/July)/ - 2pm (Xmas day)",RIC004
Richmond,Bowling Greens and Gates of the former Watney's Brewery,"Williams Lane, Mortlake",SW14 7ET,Private Open Land,520180,176001,No,site under construction,RIC004a
Richmond,Bushy House (National Physical Laboratory) *,"Hampton Road, Bushy Park, Teddington",TW11 0LW,Institutional Grounds,515498,170375,Occasionally,private (may be open days),RIC005
Richmond,Bushy Park (including Upper Lodge Gardens) *,"Hampton Court Road/High Street/Sandy Lane, Teddington",TW11/TW12/KT1/KT8,Public Park,515110,169949,Yes,unrestricted. Woodland Garden: 9am-dusk daily (closure for annual deer culls),RIC006
Richmond,"Cambridge Gardens, including Warren Footpath","Clevedon Road, Twickenham",TW1 2TA,Public Gardens,517768,174396,Yes,Mon - Sat: 7.30am - dusk/Sun & Bank Hols: 9am - dusk,RIC007
Richmond,Carlisle Park,"Wensleydale Road/Carlisle Road, Hampton",TW12 2LU,Public Park,513629,170384,Yes,Mon - Sat: 7.30am - dusk/Sun & Bank Hols: 9am - dusk,RIC008
Richmond,Castelnau Recreation Ground,Washington Road/Barnes Avenue,SW13 9AA,Public Park,522324,177382,Yes,Mon - Sat: 7.30am - dusk/Sun & Bank Hols: 9am - dusk,RIC010
Richmond,Champions Wharf and Play Beach,"Riverside, Twickenham",TW1 3DT,Public Gardens,516532,173286,Yes,unrestricted,RIC011
Richmond,Church Estate Almshouses,Sheen Road/ St Mary's Grove,TW9 1UX,Private Garden,518773,175098,Occasionally,"Has opened for OGSW. Otherwise private, for residents only",RIC012
Richmond,Crane Park,Ellerman Avenue/Hanworth Road/Great Chertsey Road/Hospital Bridge Road/Meadway,TW2 6DF,Public Park,512899,172866,Yes,Part: unrestricted. Shot Tower open 1st and last Sunday each month,RIC013
Richmond,Diamond Jubilee Gardens,"The Embankment, Twickenham",TW1 3DX,Public Gardens,516291,173172,Yes,unrestricted,RIC013a
Richmond,Dissenters Burial Ground,"Prince's Road, off South Worple Way",SW14,Public Gardens,520866,175600,Yes,unrestricted,RIC014
Richmond,East Sheen Cemetery,"Kings Ride Gardens, off Sheen Road",TW10 5BJ,Cemetery,519291,174639,Yes,10am-4.30pm (November - March); 10am - 6.30pm ( April - October),RIC015
Richmond,East Sheen Common,"Fife Road/King's Ride, Sheen",SW14,Public Open Land,519550,174650,Yes,unrestricted,RIC016
Richmond,Fieldend *,"Field End, off Waldegrave Park, Teddington",TW1,Housing/Estate Landscaping,515850,171750,Partially,"private, but it is possible to view the communal gardens from the roadway",RIC017
Richmond,Garrick's Lawn *,Hampton Court Road,TW12 2EN,Public Gardens,514195,169419,Yes,"gardens: Mon - Sat: 7.30am - dusk/Sun & Bank Hols: 9am - dusk. Temple: April-September, Sundays 2-5pm; plus special visits can be arranged",RIC018
Richmond,Gordon House,St Margaret's Road/Kilmorey Road/Railshead Road,TW1 1PX,Institutional Grounds,516691,175045,to check,,RIC019
Richmond,Grove Gardens,"Grove Gardens/The Grove, Teddington",TW11 8AS,Public Gardens,516251,171553,Yes,Mon - Sat: 7.30am - dusk/Sun & Bank Hols: 9am - dusk,RIC020
Richmond,Grove Road Gardens,"Lower Grove Road, Richmond",TW10 6SW,Public Gardens,518892,174310,Yes,Mon - Sat: 7.30am - dusk/Sun & Bank Hols: 9am - dusk.,RIC021
Richmond,Ham Common and Ham Common Woods,"Church Road/Ham Gate Avenue/Upper Ham Road, Richmond",TW10 5LA,Public Open Land,518202,171786,Yes,unrestricted,RIC022
Richmond,Ham House and Gardens *,"Ham Street, Ham, Richmond",TW10 7RS,Private Garden,517262,173049,Yes,Sat-Wed (closed Thur/Fri): Gardens 10.30am-6pm or dusk if earlier; House: April-Oct 1-5pm,RIC023
Richmond,Hampton Cemetery,"Holly Bush Lane/Broad Lane, Hampton",TW12 2QS,Cemetery,513161,170384,Yes,10am-4.30pm (November - March); 10am - 6.30pm (April - October),RIC024
Richmond,Hampton Court Green,"Hampton Court Road, Hampton",KT8 9BS,Public Open Land,515350,168850,Yes,unrestricted,RIC025
Richmond,Hampton Court House Grounds *,Hampton Court Green/Bushy Park (Campbell Road off Hampton Court Road),KT8 9BS,Institutional Grounds;,515362,169003,By appointment only,private; open for London Open House; group visits by appointment through Orleans House Gallery,RIC026
Richmond,Hampton Court Palace Gardens and Hampton Court Park *,"Hampton Court Road, East Molesey",KT8 9AU,Public Park,515726,168509,Yes,Palace/Maze 10am-6pm (summer)/-4.30pm (winter).Formal Gardens 10am-7pm (summer)/-5.30pm (winter).Informal Gardens 7am-8pm (summer)/-6pm (winter).,RIC027
Richmond,Hampton Wick War Memorial Garden,"Hampton Wick Roundabout, Hampton Wick",KT1 4AE,Public Gardens,517550,169350,Yes,,RIC027a
Richmond,Hickey's Almshouses,"Sheen Road/Grena Road/St Mary's Grove, Richmond",TW9,Private Garden,518857,175075,Occasionally,"private, visible from road. Has opened for London Open House and LGSW",RIC028
Richmond,Holly Road Garden of Rest,"Holly Road, Twickenham",TW1 4EU,Public Gardens,516148,173239,Yes,Mon - Sat: 7.30am - dusk/Sun & Bank Hols: 9am - dusk,RIC029
Richmond,Houblon's Almshouses,Worple Way,TW10 6DA,Private Garden,518446,174976,Occasionally,"Has opened for OGSW. Otherwise private, for residents only",RIC030
Richmond,Hounslow Cemetery,"Hanworth Road, Hounslow",TW4,Cemetery,512750,173750,Yes,"9am - 4pm (Nov-Feb)/- 5.30pm (Mar, Oct)/ - 7pm (Apr, May, Aug, Sept)/ - 8pm (June/July)/ - 2pm (Xmas day)",RIC031
Richmond,Jubilee Gardens,Mortlake High Street,SW14 8PT,Public Gardens,520983,176018,Yes,Mon - Sat: 7.30am - dusk/Sun & Bank Hols: 9am - dusk,RIC032
Richmond,Kew Green and Kew Pond,"Kew Road, Richmond",TW9 3AA,Public Open Land,518962,177550,Yes,unrestricted,RIC033
Richmond,"King George's Field, Ham","Ham Street, Ham",TW10 7RS,Public Park,516950,172950,Yes,Mon - Sat: 7.30am - dusk/Sun & Bank Hols: 9am - dusk,RIC034
Richmond,King's Field,"Church Grove, Hampton Wick",KT1 4AE,Public Open Land,517231,169307,Yes,"Mon - Sat: 7.30am - dusk/Sun & Bank Hols: 9am - dusk. Skate park 10am-dusk, check website for current charge per session",RIC035
Richmond,Kneller Gardens,"Meadway, Twickenham",TW2 6PH,Public Gardens,514809,173324,Yes,Mon-Sat 7.30am-dusk; Sun/Bank Holidays 9am-dusk.,RIC036
Richmond,"Langdon Park, formerly Normansfield Hospital Grounds",Normansfield Avenue/Kingston Road/Broom Road,TW11 9PS,Housing/Estate Landscaping,517386,170404,Partially,"site under development. Langdon Down Museum of Learning Disability (2a Langdon Park): open 9.30am-1.30pm Saturdays, 2-5pm Mondays",RIC047
Richmond,Maids of Honour Row,"4 Maids of Honour Row, Richmond",TW9 1NY,Private Garden,517620,174925,No,private,RIC036a
Richmond,Mallard Place,"Strawberry Vale, Twickenham",TW1,Housing/Estate Landscaping,516150,172150,Partially,"private, but communal areas appear accessible",RIC037
Richmond,Manor Road Recreation Ground,"Manor Road, Twickenham",TW11 8BF,Public Park,516552,171490,Yes,Mon - Sat: 7.30am - dusk/Sun & Bank Hols: 9am - dusk,RIC038
Richmond,Marble Hill Park *,"Richmond Road/Orleans Road, Twickenham",TW1 2NL,Public Gardens,517150,173650,Yes,Park unrestricted (check website for opening times for Marble Hill House),RIC039
Richmond,Michel's Almshouses,"The Vineyard, Richmond",TW10 6AH,Private Garden,518024,174527,Occasionally,"Has opened for OGSW. Otherwise private, for residents only",RIC040
Richmond,Moormead and Bandy Recreation Ground,"Moormead Road, Cole Park, St Margarets",TW1 1JS,Public Park,516423,174037,Yes,unrestricted,RIC041
Richmond,Mortlake Cemetery,Clifford Avenue/Mortlake Road,SW14 7BU,Cemetery,519900,176089,Yes,opens Mon-Sat 9am; Sun/Good Fri 10am; closes 4pm (Nov - Jan); 5pm (Oct/Feb); 6pm (Mar/Sep); 7pm (Aug/Apr); 8pm (May - Jul). Xmas Day 10am-3pm,RIC042
Richmond,"Mortlake Churchyard, St Mary the Virgin, Mortlake","Mortlake High Street, Mortlake",SW14 8JA,Churchyard,520839,175940,Yes,unrestricted,RIC043
Richmond,Mortlake Crematorium,"Kew Meadow Path, and via Mortlake Cemetery",TW9 4EN,Cemetery,520012,176284,Yes,9am - 4pm (November-January); 9am - 5pm (February/October); 9am - 6pm (March/September and April-August weekends); 9am - 7pm (April-August weekdays),RIC044
Richmond,Mortlake Green,"Sheen Lane/Lower Richmond Road, Mortlake",SW14 8HY,Public Open Land,520438,175885,Yes,Mon-Sat 7.30am-dusk; Sun 9am-dusk.,RIC045
Richmond,Murray Park,"Kneller Road, Twickenham",TW2 7ED,Public Park,514323,174421,Yes,Mon - Sat: 7.30am - dusk/Sun & Bank Hols: 9am - dusk,RIC046
Richmond,North Sheen Cemetery,Mortlake Road/Lower Richmond Road,TW9 4LL,Cemetery,519667,176092,Yes,opens Mon-Sat 9am; Sun/Good Fri 10am; closes 4pm (Nov - Jan); 5pm (Oct/Feb); 6pm (Mar/Sep); 7pm (Aug/Apr); 8pm (May - Jul). Xmas Day 10am-3pm,RIC048
Richmond,North Sheen Recreation Ground,"Dancer Road/Darrell Road/North Road, Sheen",TW9 4LB,Public Park,519226,176048,Yes,Mon - Sat: 7.30am - dusk/Sun & Bank Hols: 9am - dusk,RIC049
Richmond,Oak Avenue Nature Reserve,"Oak Avenue, Hampton",TW12 3UX,Nature Reservee,512237,171107,Yes,unrestricted,RIC049a
Richmond,Oak Lane Cemetery,"Oak Lane, Twickenham",TW1,Cemetery,516350,173550,Yes,Mon - Sat: 7.30am - dusk/Sun & Bank Hols: 9am - dusk,RIC050
Richmond,Old Barnes Cemetery,"off Rocks Lane (Ranelagh Path), Barnes Common",SW13,Cemetery,522599,175933,Yes,unrestricted,RIC051
Richmond,Old Deer Park *,"Kew Road/Twickenham Road, Kew",TW9 1PQ,Public Park,517552,175660,Yes,Public recreation ground is unrestricted. Rest of site is private,RIC052
Richmond,Old Mortlake Burial Ground,"South Worple Way/Avenue Gardens, Mortlake",SW14 8BP,Cemetery,521050,175650,Yes,10am-4.30pm (November - March); 10am - 6.30pm (April - October),RIC053
Richmond,Orleans House Gardens and Orleans Gardens,"Richmond Road/Riverside, Twickenham",TW1 3DG,Public Park,517008,173411,Yes,Orleans Gardens: Mon-Sat 7.30am-dusk; Sun 9am-dusk. Orleans House Grounds 9am-dusk.Orleans House Gallery: Tues-Sun:10am-5.pm,RIC054
Richmond,Palewell Common and Fields,"Palewell Common Drive/Enmore Gardens, Sheen",SW14 8RF,Public Open Land,520957,174631,Yes,unrestricted,RIC055
Richmond,Parkleys,"off Upper Ham Road, Ham",TW10,Housing/Estate Landscaping,517935,171656,Partially,Appears to have unrestricted access to public areas,RIC056
Richmond,Pesthouse Common,"Queen's Road, Richmond",TW10 6HF,Public Open Land,518989,174784,Yes,unrestricted,RIC057
Richmond,Petersham Common,Star and Garter Hill/Petersham Road,TW10,Public Open Land,518342,173611,Yes,unrestricted,RIC058
Richmond,Petersham Meadows,"Petersham Road, Richmond",TW10 7AG,Public Open Land,518032,173646,Yes,unrestricted,RIC059
Richmond,Pope's Grotto *,"Cross Deep, Twickenham",TW1 4QG,Garden Feature Remnants,516048,172762,By appointment only,or during Twickenham's Festival Week in June (enquiries to Radnor House School 020 8891 6264; info@radnorhouse.org),RIC060
Richmond,Radnor Gardens,"Cross Deep, Twickenham",TW1,Public Gardens,516027,172581,Yes,Mon - Sat: 7.30am - dusk/Sun & Bank Hols: 9am - dusk,RIC061
Richmond,Richmond Cemetery,"Lower Grove Road, Richmond",TW10,Cemetery,519050,174450,Yes,10am-4.30pm (November - March); 10am - 6.30pm (April - October),RIC062
