Borough,Site Name,Site Address,Postcode,Type of Site,Grid ref easting,Grid ref northing,Open to Public,Opening times,Site Ref
Islington,Bunhill Fields Burial Ground *,City Road/Bunhill Row,EC1,Cemetery;,532691,182258,Yes,"Mon-Fri 7.30am (9.30am Sat/Sun/BH) - 4pm (Oct-March)/7pm (April-Sept). Closed Xmas Day, Boxing Day, New Year's Day",ISL012
Islington,Caledonian Park,Market Road,N7,Public Park,530218,184757,Yes,8am - dusk,ISL013
Islington,Canonbury Square,Canonbury Square/Canonbury Road,N1 2AW,Garden Square;,531826,184453,Yes,8am - dusk,ISL015
Islington,"Canonbury Tower, Canonbury Estate",Canonbury Place,N1 2NQ,Private Garden,531950,184520,Occasionally,Guided tours of Canonbury Tower by Islington Guides (contact via e-mail on info@ciga.org.uk),ISL016
Islington,Charterhouse Precincts (Charterhouse Square and The Charterhouse),Charterhouse Square/Carthusian Street/Charterhouse Street,EC1M 6AN,Private Garden;,531920,182000,Yes,Charterhouse Square Gardens Tues-Sun 11am-5pm; Museum open 11am-4.45pm,ISL017
Islington,Christ Church Highbury with St John and St Saviour,"Highbury Grove, Highbury Barn",N5 1SA,Churchyard,531910,185460,Yes,unrestricted,ISL018
Islington,Claremont Close,Claremont Square,N1,Housing/Estate Landscaping,531370,183110,No,"private, front garden area visible",ISL019
Islington,Claremont Square Reservoir,Claremont Square,N1,Private Open Land,531168,183061,No,no access,ISL020
Islington,Clerkenwell Green,Clerkenwell Green,EC1,Public Open Land,531530,182130,Yes,unrestricted,ISL021
Islington,"Cloister Garden, Priory Church of the Order of St John of Jerusalem","St John's Square, Clerkenwell",EC1M 4DA,Private Garden,531700,182150,Yes,"Museum of the Order of St John: Mon-Sat 10am-5pm, but check museum website for church and garden opening times",ISL021a
Islington,Cloudesley Square,Cloudesley Square,N1 0HT,Public Gardens,531306,183747,Yes,unrestricted,ISL022
Islington,Compton Terrace Garden,Upper Street,N1 2XE,Public Gardens,531635,184560,Yes,8am - dusk,ISL023
Islington,Crouch Hill Park,"Crouch Hill/Hillrise Road/Warltersville Road, Crouch Hill",N8 9EG,Public Park,530110,187730,Yes,unrestricted,ISL024
Islington,Culpeper Community Garden,"Dignum Street, off Cloudesley Road",N1 0EJ,Community Garden,531190,183479,Yes,Mon-Sun 10am-6pm (or dusk),ISL024a
Islington,Dallington School Playground,Seward Street,EC1V 3RF,Institutional Grounds,532000,182480,No,private/school use only,ISL025
Islington,Dalmeny Park,Dalmeny Road,N7,Public Park,529797,185798,Yes,8am - dusk,ISL026
Islington,Dartmouth Park and Dartmouth Park Hill Reservoirs,Dartmouth Park Hill/Bickerton Road,N19,Public Park,529040,186390,Yes,8am - dusk,ISL027
Islington,Duncan Terrace Garden and Colebrooke Row Gardens,Duncan Terrace and Colebrooke Row,N1,Public Gardens,531632,183260,Yes,part unrestricted. Part: 8am - dusk,ISL028
Islington,Edward Square,Copenhagen Street/Caledonian Road,N1,Public Park,530639,183583,Yes,8am - dusk,ISL029
Islington,"Elthorne Park, including Noel-Baker Peace Garden","Hazellville Road, Hornsey Rise, Sunnyside Road, Beaumont Rise",N19 3NF,Public Park,529996,187408,Yes,unrestricted to most of the park. The Peace Garden is open in daytime hours.,ISL029a
Islington,Finsbury Square,Finsbury Square,EC2,Public Gardens,532855,181965,Yes,"8am - dusk. Bowling Green: from Tuesday after first bank holiday in May until 30 September

 end Apr - early Oct; Mon-Fri 12-8pm",ISL030
Islington,Fortune Street Park,Fortune Street/Golden Lane,EC1,Public Gardens,532340,182070,Yes,8am - dusk,ISL031
Islington,Freightliners Farm,Sheringham Road,N7 8PF,Other,531095,184926,Yes,Autumn/winter 10am-4pm; spring/summer 10am-4.45pm. Closed Mondays apart from Bank Holidays. Closed Christmas week.,ISL031a
Islington,Gibson Square,Gibson Square,N1,Garden Square;,531476,183836,Yes,8am - dusk,ISL032
Islington,Gillespie Park and Nature Reserve,"Drayton Park, Gillespie Road, Quill Street, Seven Sisters Road",N5 1LP,Public Park,531365,186160,Yes,8.00am - dusk,ISL032a
Islington,Granville Square,Granville Square/Lloyd Baker Street,WC1,Garden Square;,530959,182659,Yes,8am - dusk,ISL033
Islington,Highbury Fields,Highbury Crescent/Highbury Grove/Highbury Place/Highbury Terrace/Baalbec Road,N5,Public Park,531730,185120,Yes,unrestricted [playground in south 8am - dusk],ISL034
Islington,Highbury Park Terrace,Highbury Park,N5,Private Garden,531943,185723,Yes,unrestricted,ISL035
Islington,Highbury Quadrant Congregational Church,Highbury Quadrant,N5 2TE,Private Garden,532110,186140,Occasionally,gate locked but may be open when church in use,ISL036
Islington,Highbury Quadrant Estate,Highbury New Park/Highbury Quadrant,N5,Housing/Estate Landscaping,532230,186110,Yes,unrestricted,ISL037
Islington,Highbury Roundabout and Highbury Corner Garden,"Highbury Corner, Islington",N1,Public Open Land,531650,184690,No,visible from surrounding roads,ISL037a
Islington,Holford Gardens,off Percy Circus,WC1,Public Gardens,530930,182950,Yes,8am - dusk,ISL038
Islington,Holly Park Estate,Holly Park/Crouch Hill,N4,Housing/Estate Landscaping,530560,187640,Yes,"for residents use, although there is public access through the estate",ISL039
Islington,Islington Green,Upper Street/Essex Road/Islington Green,N1,Public Gardens,531657,183624,Yes,8am - dusk,ISL040
Islington,John Spencer Square,Prior Bolton Street,N1,Housing/Estate Landscaping,531892,184724,No,"private, visible",ISL042
Islington,Joseph Grimaldi Park,Pentonville Road/Rodney Street/Collier Street/Cumming Street,N1,Public Gardens,530840,183130,Yes,8am - dusk,ISL043
Islington,King Henry's Walk Garden including Docwra's Wood,11c King Henry's Walk,N1 4NX,Community Garden,533112,184942,Yes,"12pm-4pm on Saturdays all year, Sundays from May to September. Open to members every day during daylight hours",ISL043a
Islington,King Square Gardens,King Square,EC1V 8DB,Public Gardens,531985,182678,Yes,8am - dusk,ISL044
Islington,Lloyd Square,Lloyd Square/Lloyd Baker Street,WC1X 9AJ,Garden Square,531097,182769,Occasionally,"Has opened for OGSW. Otherwise private, for keyholders only",ISL045
Islington,Lonsdale Square,Lonsdale Square,N1,Garden Square;,531294,183996,Yes,8am - dusk,ISL046
Islington,Market Road Gardens,Market Road,N7,Public Gardens,530463,184713,Yes,8am - dusk,ISL047
Islington,Market Road Pitches,Market Road,N7 9NT,Public Open Land,530156,184600,By appointment only,Mon-Fri 10am - 10pm; Sat/Sun 10am - 6pm,ISL047a
Islington,"Marquess Estate, including St Paul's Park",Essex Road/St Paul's Road,N1,Housing/Estate Landscaping,532593,184712,Yes,unrestricted,ISL048
Islington,Metropolitan Benefit Societies Almshouses,Balls Pond Road,N1,Private Garden,533160,184840,No,private,ISL049
Islington,Milner Square,Milner Square,N1,Garden Square;,531495,184032,Yes,8am - dusk,ISL050
Islington,"Mountfort Crescent, Barnsbury Square",Barnsbury Square,N1,Private Garden,531032,184272,No,"private, visible",ISL051
Islington,"Mountfort Terrace, Barnsbury Square",Barnsbury Square,N1,Housing/Estate Landscaping,531048,184188,Yes,"unrestricted, albeit private",ISL052
Islington,Myddelton Square Public Garden,Myddelton Square,EC1,Garden Square;,531305,182937,Yes,8am - dusk,ISL053
Islington,New River Head,Rosebery Avenue/Myddelton Passage,EC1,Housing/Estate Landscaping,531350,182777,Partially,"Garden of Nautilus Building; 8am-4pm (winter), 7pm (summer). Site visible from viewing platform",ISL054
Islington,New River Walk including Astey's Row Rock Gardens/Astey's Row Playground,"St Paul's Road/Canonbury Grove, Canonbury Villas & Astey's Row",N1 2PU,Public Park,532170,184410,Yes,8am - dusk,ISL055
Islington,Newington Green,Newington Green,N16 9PX,Public Gardens,532855,185362,Yes,8am - dusk,ISL056
Islington,Northampton Square Gardens,Northampton Square,EC1V 0HL,Public Gardens,531735,182641,Yes,8am - dusk,ISL057
Islington,Owen's Field,"Owen Street, Owen's Row",EC1V 7JX,Public Park,531567,183015,Yes,8am - dusk,ISL057a
Islington,"Packington Estate, including Packington Gardens","Arlington Avenue, adjacent to Regent's Canal",N1,Housing/Estate Landscaping,532200,183530,Yes,unrestricted to public areas,ISL058
Islington,"Paradise Park, including Martin Luther King Playground",Lough Road; Mackenzie Road,N7 8BZ,Public Park,531015,184939,Yes,8am-dusk,ISL058a
Islington,Parkland Walk,"Access: Crouch Hill, Mountview Road, Archway Road",N8/N19/N4,Public Open Land,529910,188470,Yes,unrestricted,ISL059
Islington,"Peckett Square and Taverner Square, Taverner Estate",off Highbury Park,N5,Housing/Estate Landscaping,532037,185665,No,"private, for residents use",ISL060
Islington,Penn Road Gardens,Penn Road/Caledonian Road,N7,Public Gardens,530541,185554,Yes,8am - dusk,ISL061
Islington,Percy Circus,Percy Circus,WC1,Garden Square;,530905,182831,Yes,8am - dusk,ISL062
Islington,Prebend Street Island,Prebend Street/Popham Street,N1,Public Gardens,532150,183710,Yes,unrestricted,ISL063
Islington,Quaker Gardens,Banner Street,EC1,Public Gardens,532529,182262,Yes,8am - dusk,ISL064
Islington,Radnor Street Gardens,Radnor Street/Lizard Street,EC1V 3QZ,Public Gardens,532370,182530,Yes,8am - dusk,ISL065
Islington,Regent's Canal (Islington section) including Battle Bridge Basin and City Road Basin,"West section: access at York Way, Caledonian Rd, Muriel Street. East section: access at Colebrooke Row, Danbury St, Wharf Road",N1 9RT (Canal Museum),Public Open Land,530350,183450,Yes,"London Canal Museum Tue-Sun, BH Mons 10am-4.30pm",ISL066
Islington,Rosemary Gardens,Shepperton Road/Sherborne Street/Southgate Road (near Rosemary Street),N1,Public Park,532724,183905,Yes,Part unrestricted. Part: 8am - 10pm,ISL067
Islington,Royal Northern Gardens,Manor Gardens,N7,Public Gardens,530230,186340,Yes,8am - dusk,ISL067a
Islington,Samuel Lewis Trust Dwellings,Liverpool Road/Laycock Street,N1,Housing/Estate Landscaping,531400,184490,No,"private, visible from Liverpool Road",ISL081
Islington,Spa Fields Gardens,Northampton Road/Skinner Street,EC1,Public Gardens,531320,182420,Yes,unrestricted,ISL082
Islington,Spa Green Gardens,Rosebery Avenue,EC1,Public Gardens,531450,182770,Yes,8am - dusk,ISL083
Islington,St Bartholomew's Medical College Green,Charterhouse Square/Rutland Place,EC1M 6BQ,Institutional Grounds,531950,182040,No,"private, use of college/local residents only",ISL068
Islington,St James Clerkenwell Church Garden,Clerkenwell Close/Clerkenwell Green,EC1,Public Gardens,531520,182220,Yes,8am - dusk. Church Open Mon-Fri 12-2pm,ISL069
Islington,St James Close and Clothworkers Almshouses,1-8 Bishop Street,N1,Private Garden,532170,183770,Occasionally,"Has opened for OGSW. Otherwise private, for residents only",ISL070
Islington,"St John's Church, Upper Holloway",Holloway Road/St John's Grove,N19,Churchyard,529700,186650,No,"closed, partly visible",ISL072
Islington,St John's Churchyard,"Jerusalem Passage/St John Street, Clerkenwell",EC1,Public Gardens,531725,182184,Yes,8am - dusk,ISL071
Islington,St John's Garden,"Benjamin Street/Britten Street, Clerkenwell",EC1,Public Gardens,531630,181930,Yes,8am - dusk,ISL073
Islington,St John's Island Site,St John Street/Percival Street,EC1,Public Open Land,531643,182499,Yes,unrestricted,ISL074
Islington,St Joseph's Church and Retreat Gardens,Dartmouth Park Hill/Highgate Hill,N19 5NE,Private Garden,528429,187310,Occasionally,Has opened for London Open House,ISL075
Islington,St Luke's Church and Gardens,Old Street/Helmet Row,EC1,Public Gardens,532300,182450,Yes,8am - dusk,ISL076
Islington,St Mary Magdalene Gardens,"Holloway Road/Madras Place/Liverpool Road, Lower Holloway",N7,Public Gardens,531260,184930,Yes,8am - dusk. Church open (creche),ISL077
Islington,St Mary's Church Gardens,Upper Street,N1,Public Gardens,531760,183860,Yes,8am - dusk,ISL078
Islington,St Paul's Shrubbery,"entrances from St Paul's Road, Northampton Park",N1,Public Park,532570,184900,Yes,8am - dusk,ISL079
Islington,St Silas Church Gardens,Penton Street,N1 9UL,Public Gardens,531051,183302,Yes,8am - dusk,ISL080
Islington,Sussex Close,Bavaria Road,N19,Housing/Estate Landscaping,530223,186750,Yes,"private, but publicly accessible",ISL084
Islington,The Jewish Burial Ground,Kingsbury Road,N1,Cemetery,533270,184954,Yes,appears unrestricted,ISL041
Islington,Thornhill Crescent,Thornhill Crescent/Bridgeman Road,N1,Public Gardens,530801,184154,Yes,8am - dusk,ISL085
Islington,Thornhill Road Gardens,Thornhill Road/Malvern Terrace,N1,Public Gardens,531134,183920,Yes,8am - dusk,ISL086
Islington,Thornhill Square Gardens,"Thornhill Square, Liverpool Road",N1,Public Gardens,530807,184050,Yes,8am - dusk,ISL087
Islington,Tibberton Square,"Popham Road, off New North Road",N1,Garden Square;,532176,184001,Yes,unrestricted,ISL088
Islington,Tufnell Park Playing Fields,Campdale Road/Tufnell Park Road,N7 0EG,Public Park,529467,186041,Yes,8am - dusk,ISL089
Islington,Union Square Gardens,Union Square,N1,Garden Square;,532242,183605,Yes,8am - dusk,ISL090
Islington,Vernon Square,"Vernon Rise, Finsbury",WC1,Public Gardens,530817,182900,Yes,unrestricted,ISL091
Islington,Wesley's Chapel Burial Ground and Wesley House Garden,49 City Road,EC1Y 1AU,Churchyard,530817,182260,Yes,"Mon-Sat 10am-4pm, Sun 12.30-1.45pm. Closed Thurs bet 12.45 & 1.30pm for service, and between Christmas & New Year, Public Holidays except Good Friday",ISL092
Islington,Whittington Park,Holloway Road,N19 4DJ,Public Park,529800,186430,Yes,8am - dusk,ISL092a
Islington,Wilmington Square Gardens,Wilmington Square,WC1,Garden Square;,531172,182564,Yes,8am - dusk,ISL093
Islington,Wilton Square,New North Road/Wilton Square,N1,Garden Square;,532580,183766,Yes,8am - dusk,ISL094
Kensington & Chelsea,Addison Gardens,Holland Villas Road/Addison Gardens,W14,Private Garden,524100,179820,No,private,KAC001
Kensington & Chelsea,Albert Bridge Garden,Chelsea Embankment,SW3,Public Gardens,527350,177620,Yes,unrestricted,KAC001a
Kensington & Chelsea,Alec Clifton-Taylor Memorial Gardens,Kensington Church Walk off Kensington High Street,W8,Public Gardens,525540,179660,Yes,7.30am - dusk,KAC002
Kensington & Chelsea,Alexander Square (North and South),Brompton Road,SW3,Garden Square,527180,178950,No,private,KAC003
Kensington & Chelsea,All Saints Churchyard and St Thomas More Gardens,Chelsea Embankment,SW3,Churchyard,527100,177570,Partially,Churchyard garden accessible when church open; St Thomas More Gardens unrestricted.,KAC004
Kensington & Chelsea,Allen Hall Seminary Garden,28 Beaufort Street,SW3 5AA,Institutional Grounds,526850,177660,Occasionally,Has opened for OGSW (2007),KAC005
Kensington & Chelsea,Arundel and Elgin Communal Garden (Ladbroke Estate) *,Kensington Park Road/Ladbroke Grove,W11 2ER,Garden Square,524565,180997,Occasionally,"Has opened for OGSW. Otherwise private, for keyholders only",KAC006
Kensington & Chelsea,Arundel and Ladbroke Gardens (Ladbroke Estate) *,Kensington Park Road/Ladbroke Grove,W11 2EP,Garden Square,524608,180903,Occasionally,"Has opened for OGSW. Otherwise private, for keyholders only",KAC007
Kensington & Chelsea,Ashburn Gardens,Cromwell Road/Courtfield Road,SW7,Private Open Land,526150,178750,No,private,KAC008
Kensington & Chelsea,Ashburn Place Gardens,Ashburn Place/Harrington Road,SW7,Garden Square,526108,178699,No,private,KAC009
Kensington & Chelsea,Avondale Park,Walmer Road,W11,Public Park,524122,180583,Yes,7.30am - dusk,KAC010
Kensington & Chelsea,Avondale Park Gardens,Avondale Park Gardens,W11,Garden Square,524020,180710,No,private,KAC011
Kensington & Chelsea,Barkston Gardens,Barkston Gardens,SW5,Garden Square,525681,178552,No,"private, for keyholders only",KAC012
Kensington & Chelsea,Barlby Gardens,Barlby Road,W10,Private Garden,523760,182050,No,private,KAC013
Kensington & Chelsea,Battersea Bridge Gardens,Cheyne Walk/Chelsea Embankment/Battersea Bridge,SW3,Public Gardens,526910,177460,Yes,unrestricted,KAC014
Kensington & Chelsea,Bina Gardens East,Bina Gardens/Dove Mews off Rosary Gardens,SW7 4NH,Private Garden,526231,178550,Occasionally,"Has opened for OGSW. Otherwise private, for keyholders only",KAC015
Kensington & Chelsea,Bina Gardens West,Bina Gardens,SW5,Garden Square,526175,178541,Occasionally,"Has opened for OGSW. Otherwise private, for keyholders only.",KAC016
Kensington & Chelsea,Blenheim and Elgin Crescents Garden (Ladbroke Estate) *,Blenheim Crescent/Elgin Crescent,W11 2EG,Garden Square,524342,180942,Occasionally,"Has opened for OGSW. Otherwise private, for keyholders only",KAC017
Kensington & Chelsea,Bolton Gardens,Bolton Gardens,SW5,Garden Square,525966,178420,No,"private, for keyholders only",KAC018
Kensington & Chelsea,Bramham Gardens,Bramham Gardens,SW5 0HF,Garden Square,525808,178459,Occasionally,"Has opened for OGSW. Otherwise private, for keyholders only",KAC020
Kensington & Chelsea,Brompton Cemetery *,"Old Brompton Road, Fulham Road",SW10 9UG,Cemetery,525719,177795,Yes,"8am-4pm (Jan, Nov, Dec) / -5pm (Feb, Oct) / -6pm (March, late Sept) /-7pm (April, early Sept)/-8pm (May-August)",KAC021
Kensington & Chelsea,Brompton Square,Brompton Square/Brompton Road,SW3,Garden Square,527216,179263,Occasionally,"Has opened for OGSW. Otherwise private, for keyholders only",KAC022
Kensington & Chelsea,Cadogan Gardens,Cadogan Gardens,SW3,Garden Square,527832,178752,By appointment only,"By appointment only. Otherwise private, for keyholders only",KAC023
Kensington & Chelsea,Cadogan Place Gardens *,"Cadogan Place, Sloane Street",SW1X 9PQ,Garden Square,527960,179050,Occasionally,"Has opened for OGSW. Otherwise private, for keyholders only",KAC024
Kensington & Chelsea,Cadogan Square Gardens,Cadogan Square/Milner Street,SW1X 0EE,Garden Square,527780,178950,Occasionally,"Has opened for OGSW. Otherwise private, for keyholders only",KAC025
Kensington & Chelsea,Cadogan Square Small,Cadogan Square,SW1,Private Garden,527750,178950,No,"private, visible from street",KAC026
Kensington & Chelsea,Campden Hill Square,Campden Hill Square,W8,Garden Square,524872,180257,No,"private, for keyholders only",KAC027
Kensington & Chelsea,Carlyle Square Gardens,Carlyle Square,SW3,Garden Square,526971,178001,Occasionally,"Has opened for OGSW. Otherwise private, for keyholders only",KAC028
Kensington & Chelsea,Carlyle's House Garden,"24 Cheyne Row, off Cheyne Walk, Chelsea",SW3 5HL,Private Garden,527180,177720,Yes,"April/end March-October/early November, Wed - Sun, 11-5. Closed Good Friday.",KAC029
Kensington & Chelsea,Chelsea Bridge Garden,Chelsea Embankment,SW3,Public Gardens,528460,177890,No,inaccessible,KAC030
Kensington & Chelsea,Chelsea Embankment Gardens,Chelsea Embankment/Cheyne Walk,SW3,Public Gardens,527350,177640,Yes,unrestricted,KAC031
Kensington & Chelsea,Chelsea Green,Elystan Street/Cale Street,SW3,Public Gardens,527399,178453,Yes,unrestricted,KAC032
Kensington & Chelsea,Chelsea Park Gardens,Chelsea Park Gardens/Beaufort Street,SW3,Housing/Estate Landscaping,526660,177810,No,private but visible,KAC033
Kensington & Chelsea,Chelsea Physic Garden *,66 Royal Hospital Road/Chelsea Embankment/Swan Walk,SW3 4HS,Botanical Institution,527710,177788,Yes,To 31 Oct 2016: Sun/Tue-Fri 11am-6pm. 2017: 31 Jan-31 Mar & 31 Oct-31 Dec Mon-Fri 11am-3pm. 2 Apr-29 Oct 11am-6pm or dusk if earlier.,KAC034
Kensington & Chelsea,Chelsea Square,Chelsea Square,SW3,Garden Square,526931,178224,No,private but visible from public road,KAC035
Kensington & Chelsea,Cheyne Gardens,Cheyne Gardens,SW3,Garden Square;,527440,177780,Yes,unrestricted,KAC036
Kensington & Chelsea,Clarendon Road and Lansdowne Garden (Ladbroke Estate) *,Clarendon Road/Lansdowne Rise,W11 3AG,Garden Square,524415,180579,Occasionally,"Has opened for OGSW. Otherwise private, for keyholders only",KAC038
Kensington & Chelsea,Clarendon Road and Lansdowne Road Communal Garden (Ladbroke Estate) *,Clarendon Road/Lansdowne Road,W11 2LQ,Garden Square,524468,180459,Occasionally,"Has opened for OGSW. Otherwise private, for keyholders only",KAC039
Kensington & Chelsea,Coleherne Court,The Little Boltons/Old Brompton Road/Redcliffe Gardens,SW5 0ED,Housing/Estate Landscaping,525860,178240,No,private,KAC040
Kensington & Chelsea,Collingham Gardens,Collingham Gardens,SW5 0HW,Garden Square,525915,178516,Occasionally,"Has opened for OGSW. Otherwise private, for keyholders only",KAC041
Kensington & Chelsea,Colville Gardens,Colville Place,W10,Housing/Estate Landscaping,529523,181686,No,private,KAC042
Kensington & Chelsea,Colville Square Gardens,Colville Square,W11,Garden Square;,524734,181168,Yes,7.30am - dusk,KAC043
Kensington & Chelsea,Convent of the Assumption Garden,21-23 Kensington Square/14 South End,W8,Private Garden,525710,179360,Occasionally,open to users of the Centre and has opened for OGSW,KAC046
Kensington & Chelsea,Cornwall Gardens,Cornwall Gardens,SW7 4AW,Garden Square,526027,179104,Occasionally,"Has opened for OGSW. Otherwise private, for keyholders only",KAC047
Kensington & Chelsea,Courtfield Gardens (East),"Courtfield Gardens, Collingham Road",SW5 0NQ,Garden Square,525930,178720,Occasionally,"Has opened for OGSW. Otherwise private, for keyholders only",KAC048
Kensington & Chelsea,Courtfield Gardens (West),Courtfield Gardens,SW5 0PD,Garden Square,525820,178670,Occasionally,"Has opened for OGSW. Otherwise private, for keyholders only",KAC049
Kensington & Chelsea,Cranley Gardens,Old Brompton Road,SW7,Private Garden,526490,178440,No,private,KAC050
Kensington & Chelsea,Cranley Mews,Evelyn Gardens/Cranley Mews,SW7,Private Garden,526510,178250,No,private,KAC051
Kensington & Chelsea,Cremorne Gardens,"Lots Road, Chelsea Embankment",SW10,Public Gardens,526590,177200,Yes,7.30am - dusk,KAC052
Kensington & Chelsea,Cresswell Gardens,"Cresswell Gardens, off Old Brompton Road",SW5,Private Garden,526146,178378,No,private,KAC053
Kensington & Chelsea,Debenham House Garden,"8, Addison Road",W14 8DJ,Private Garden,524440,179700,No,private,KAC054
Kensington & Chelsea,Dovehouse Green,King's Road/Dovehouse Street,SW3,Public Gardens,527160,178080,Yes,unrestricted,KAC056
Kensington & Chelsea,Duke of York Square,King's Road/Cheltenham Terrace/Franklin's Row,SW3,"Square, Private Open Land",527890,178439,Partially,new square: public (grounds fronting Headquarters Building private),KAC057
Kensington & Chelsea,Earl's Court Square,Earl's Court Square,SW5 9DG,Garden Square,525567,178312,Occasionally,"Has opened for OGSW. Otherwise private, for keyholders only",KAC058
Kensington & Chelsea,Earl's Terrace,High Street Kensington/Earls Terrace,W8,Private Garden,524950,179210,No,"private, for keyholders only",KAC059
Kensington & Chelsea,Edwardes Place,"1-7 Edwardes Place, Kensington High Street",W8,Private Garden,524850,179150,No,private,KAC060
Kensington & Chelsea,Edwardes Square *,Edwardes Square,W8,Garden Square,524998,179121,Occasionally,"Has opened for OGSW. Otherwise private, for keyholders only",KAC061
Kensington & Chelsea,Egerton Crescent Gardens,Egerton Crescent,SW3,Garden Square,527270,178980,No,"private, for keyholders only",KAC062
Kensington & Chelsea,Egerton Gardens,Egerton Gardens,SW3,Garden Square,527262,179063,No,"private, for keyholders only",KAC063
Kensington & Chelsea,Egerton Place Garden,Egerton Terrace/Egerton Place,SW3,Private Garden,527350,179120,No,private,KAC064
Kensington & Chelsea,Elm Park Gardens,Elm Park Gardens,SW10,Garden Square,526718,178120,No,"private, for keyholders only",KAC065
Kensington & Chelsea,Emperor's Gate,Grenville Place/Emperor's Gate,SW7,Garden Square,526000,179000,No,private,KAC066
Kensington & Chelsea,Emslie Horniman Pleasance Gardens,Bosworth Road/East Row/Kensal Road,W10,Public Park,524309,182208,Yes,7.30am - dusk (children's under-8s playground Tue-Fri 3-7pm; Sat 11am-5pm,KAC067
Kensington & Chelsea,Evelyn Gardens,Evelyn Gardens,SW7,Private Garden,526584,178192,No,"private, for keyholders only",KAC068
Kensington & Chelsea,Gledhow Gardens,Old Brompton Road/Bolton Gardens,SW5 0AY,Garden Square,526087,178491,Occasionally,"Has opened for OGSW. Otherwise private, for keyholders only",KAC069
Kensington & Chelsea,Grand Union Canal Towpath (Paddington Arm),"Access points: Ladbroke Grove, Harrow Road, Great West Road",W10,Public Open Land,523050,182350,Yes,unrestricted,KAC070
Kensington & Chelsea,Hanover Gardens (Ladbroke Estate) *,Lansdowne Walk,W11 3LN,Garden Square,524594,180510,Occasionally,"Has opened for OGSW. Otherwise private, keyholders only",KAC071
Kensington & Chelsea,Hans Place Garden *,Hans Place,SW1,Garden Square,527752,179256,By appointment only,"Otherwise private, for keyholders only",KAC072
Kensington & Chelsea,Harrington Gardens,Harrington Gardens,SW7,Garden Square,526090,178690,No,"private, for keyholders only",KAC073
Kensington & Chelsea,Hereford Square,Hereford Square/Gloucester Road,SW7 4TS,Garden Square,526341,178617,Occasionally,"Has opened for OGSW. Otherwise private, for keyholders only",KAC074
Kensington & Chelsea,Holland House Garden *,"Duchess of Bedford Walk, Holland Park",W8 7QU,Private Garden,525010,179706,Occasionally,Has opened for OGSW,KAC075
Kensington & Chelsea,Holland Park *,Holland Park/Abbotsbury Road/High Street Kensington,W8 6LU,Public Park,524820,179739,Yes,7.30am - dusk,KAC076
Kensington & Chelsea,Holland Park Gardens,135-159 Holland Park Avenue,W11,Private Garden,524280,180050,No,private,KAC077
Kensington & Chelsea,Holy Trinity Churchyard,Brompton Road/Ennismore Gardens Mews,SW1,Public Gardens,527100,179230,Yes,unrestricted,KAC079
Kensington & Chelsea,Hyde Park Gate,"Hyde Park Gate, off Kensington High Street",SW7,Garden Square,526230,179490,No,private,KAC080
Kensington & Chelsea,Inverness Gardens,1-8 Inverness Gardens/Vicarage Gate,W8,Private Garden,525540,180040,No,"private, but visible from roadway",KAC081
Kensington & Chelsea,Iverna Court Garden,Iverna Gardens/Iverna Court,W8 6TY,Garden Square,525470,179430,Occasionally,"Has opened for OGSW. Otherwise private, for keyholders only",KAC082
